{
  "version": 1,
  "unit": "date",
  "title": "Standalone preview \u2014 thin arcs",
  "description": "Small embedded sample for file:// or vite /standalone.html (delicate stroke widths).",
  "magnitudeLabel": "Budget (USD)",
  "spanLabel": "Calendrier",
  "countLabel": "Projets",
  "defaults": {
    "geometry": "arc",
    "colorScheme": "warm",
    "animate": true,
    "tickers": [
      "count",
      "magnitudeSum"
    ]
  },
  "marks": [
    {
      "id": "proj-015",
      "label": "Cascade Platform",
      "span": {
        "start": "2019-02-09",
        "end": "2019-06-09"
      },
      "magnitude": 514000,
      "revealAt": "2019-02-09",
      "cohort": "2019",
      "group": "Product",
      "meta": {
        "owner": "Radia P.",
        "status": "shipped"
      }
    },
    {
      "id": "proj-057",
      "label": "Yellowstone Migration",
      "span": {
        "start": "2019-02-09",
        "end": "2020-08-09"
      },
      "magnitude": 53000,
      "revealAt": "2019-02-09",
      "cohort": "2019",
      "group": "Product",
      "meta": {
        "owner": "Katherine J.",
        "status": "active"
      }
    },
    {
      "id": "proj-002",
      "label": "Ridge Expansion",
      "span": {
        "start": "2019-03-07",
        "end": "2019-06-07"
      },
      "magnitude": 63000,
      "revealAt": "2019-03-07",
      "cohort": "2019",
      "group": "Security",
      "meta": {
        "owner": "Tim B.",
        "status": "active"
      }
    },
    {
      "id": "proj-048",
      "label": "Tide Service",
      "span": {
        "start": "2019-10-01",
        "end": "2020-12-01"
      },
      "magnitude": 3799000,
      "revealAt": "2019-10-01",
      "cohort": "2019",
      "group": "R&D",
      "meta": {
        "owner": "Radia P.",
        "status": "active"
      }
    },
    {
      "id": "proj-064",
      "label": "Beacon v2",
      "span": {
        "start": "2020-05-14",
        "end": "2021-07-14"
      },
      "magnitude": 2617000,
      "revealAt": "2020-05-14",
      "cohort": "2020",
      "group": "Infrastructure",
      "meta": {
        "owner": "Radia P.",
        "status": "active"
      }
    },
    {
      "id": "proj-007",
      "label": "Tide Upgrade",
      "span": {
        "start": "2021-01-28",
        "end": "2021-10-28"
      },
      "magnitude": 93000,
      "revealAt": "2021-01-28",
      "cohort": "2021",
      "group": "Platform",
      "meta": {
        "owner": "Katherine J.",
        "status": "active"
      }
    },
    {
      "id": "proj-037",
      "label": "Lumen MVP",
      "span": {
        "start": "2021-02-22",
        "end": "2021-05-22"
      },
      "magnitude": 5844000,
      "revealAt": "2021-02-22",
      "cohort": "2021",
      "group": "Infrastructure",
      "meta": {
        "owner": "Katherine J.",
        "status": "shipped"
      }
    },
    {
      "id": "proj-003",
      "label": "Willow Dashboard",
      "span": {
        "start": "2021-07-08",
        "end": "2023-07-08"
      },
      "magnitude": 206000,
      "revealAt": "2021-07-08",
      "cohort": "2021",
      "group": "GTM",
      "meta": {
        "owner": "Edsger D.",
        "status": "active"
      }
    },
    {
      "id": "proj-055",
      "label": "Beacon Pipeline",
      "span": {
        "start": "2022-04-27",
        "end": "2024-04-27"
      },
      "magnitude": 285000,
      "revealAt": "2022-04-27",
      "cohort": "2022",
      "group": "Infrastructure",
      "meta": {
        "owner": "Ada L.",
        "status": "paused"
      }
    },
    {
      "id": "proj-021",
      "label": "Zephyr Launch",
      "span": {
        "start": "2022-10-11",
        "end": "2025-04-11"
      },
      "magnitude": 1624000,
      "revealAt": "2022-10-11",
      "cohort": "2022",
      "group": "Infrastructure",
      "meta": {
        "owner": "Katherine J.",
        "status": "active"
      }
    },
    {
      "id": "proj-047",
      "label": "Aurora Toolkit",
      "span": {
        "start": "2023-03-18",
        "end": "2023-07-18"
      },
      "magnitude": 5793000,
      "revealAt": "2023-03-18",
      "cohort": "2023",
      "group": "Infrastructure",
      "meta": {
        "owner": "Grace H.",
        "status": "planned"
      }
    },
    {
      "id": "proj-061",
      "label": "Cedar Service",
      "span": {
        "start": "2023-06-19",
        "end": "2025-06-01"
      },
      "magnitude": 1891000,
      "revealAt": "2023-06-19",
      "cohort": "2023",
      "group": "Security",
      "meta": {
        "owner": "Barbara L.",
        "status": "shipped"
      }
    }
  ]
}
